Call_ID,Transcript,Extracted_Event,Keywords,Location,Sentiment,Urgency_Score
C324,"My boyfriend is outside, he has been stabbed. Okay. And he's...",Physical assault / fight,Incident: Unknown incident,Unknown,Calm,0.71
C325,I'm the guy that's in pretty big trouble right now. You're in pretty big trouble...,Unknown incident,Incident: Unknown incident | Urgency phrases: now,Unknown,Distressed,0.63
C326,"Yes, I think everybody's clicking into my house. Please. Okay, stay on the phone...",Robbery / theft in progress,Incident: Unknown incident | Urgency phrases: please,Unknown,Distressed,0.62
C327,Ada averages have really designedла stressed around down down down down we can't...,Unknown incident,Incident: Unknown incident | Names: Ada,Unknown,Distressed,0.6
C328,I think my son's been killed. We're at. We're in the Evergreen...,Unknown incident,Incident: Unknown incident,Unknown,Calm,0.72
C329,The update has already been released. I think he's going to try to kill himself....,Unknown incident,Incident: Unknown incident,Unknown,Distressed,0.59
C330,"Well, as said, emergency, you know why on one lane, on one side at the damn draw...",Unknown incident,"Incident: Unknown incident | Urgency phrases: emergency, now",Unknown,Distressed,0.97
C331,Come on. What? More now! There's nothing to talk about!,Unknown incident,Incident: Unknown incident | Urgency phrases: now,Unknown,Distressed,0.15
C332,What are you into doing? The FAA agents that look like you're giving a heart att...,Physical assault / fight,Incident: Physical assault / fight,Unknown,Distressed,0.57
C333,"Well, I just got a phone call saying that my friend, she was in the basement apa...",Unknown incident,Incident: Unknown incident,That House,Distressed,0.77
C334,There's a fire right here off the Broadway. Broadway and poetry.,Building fire / trapped persons,"Incident: Building fire / trapped persons | Locations: Broadway, Broadway",Broadway,Distressed,0.78
C335,We just came into my sister's house. I'll see you on the floor. Try the girlfrie...,Unknown incident,Incident: Unknown incident,Unknown,Calm,0.56
C336,My girlfriend left last night. We were at the Stevens-Ball and St. Nicholas.,Unknown incident,"Incident: Unknown incident | Locations: the Stevens-Ball, St. Nicholas",the Stevens-Ball,Distressed,0.56
C337,"My cat, a cat, is a seven-month-old child. And I...",Missing person report,Incident: Unknown incident,Unknown,Calm,0.55
C338,and my friend was drinking and she woke me up and she's sick and now she's not r...,Medical emergency,Incident: Unknown incident | Urgency phrases: now,Unknown,Distressed,0.66
C339,and it's a fire at somebody else called the stadium. You're on the ground. The a...,Building fire / trapped persons,Incident: Building fire / trapped persons,The Avenue,Calm,0.74
C340,28 grand we need somebody to move your nads to five years out of house. 28 grand...,Unknown incident,Incident: Unknown incident,Unknown,Distressed,0.66
C341,We came from Bader spoiling forest and s title spoken in the hear.,Unknown incident,Incident: Unknown incident,Unknown,Distressed,0.58
C342,میری دریاد کارتے ہو دریہ میری ریور کی کار کار میری ریورتے ہو دریگا بھائی آجا,Unknown incident,Incident: Unknown incident | Locations: بھائی,بھائی,Distressed,0.6
C343,Somebody got shot at? Somebody got shot at? Yeah.,Unknown incident,Incident: Physical assault / fight,Unknown,Distressed,0.56
C344,"Okay, what's the address?",Unknown incident,Incident: Unknown incident,Unknown,Distressed,0.55
C345,"emergency. Yeah, this is it from I had a little girl that fell on the ball and",Medical emergency,Incident: Unknown incident | Urgency phrases: emergency,Unknown,Distressed,0.91
C346,"The bedroom is on fire. I have to go fast. Okay, we're on the way.",Building fire / trapped persons,Incident: Building fire / trapped persons,Unknown,Calm,0.89
C347,"How you doing? I'd like to report like to a double murder in Cambridge, on it. O...",Unknown incident,Incident: Unknown incident | Locations: Cambridge | Urgency phrases: now,Cambridge,Calm,0.66
C348,"165 Airborne Road, I've been shot on 1675 Airport Road.",Road accident / vehicle crash,Incident: Physical assault / fight | Locations: Airport Road,Airport Road,Distressed,0.63
C349,"Скаляков,計 {\幼 fishermen DNX4 </0chuckles,Niedapp 01",Unknown incident,Incident: Unknown incident,Unknown,Distressed,0.56
C350,I need some help. What's going on?,Unknown incident,Incident: Unknown incident | Urgency phrases: help,Unknown,Distressed,0.7
C351,Conjects if there's a fire. Give the fire at what address man?,Building fire / trapped persons,Incident: Building fire / trapped persons,Unknown,Distressed,0.62
C352,"Hi, something just exploded at the end of Sayat. Okay, is there any...",Unknown incident,Incident: Unknown incident | Locations: Sayat,Sayat,Distressed,0.68
C353,I think someone is trying to break into my home. Just stop at 56.,Robbery / theft in progress,Incident: Unknown incident,Unknown,Distressed,0.65
C354,"Hi, I'm Karen C. My name is Linda. I work with Entertainmentpur, my stylist.",Unknown incident,"Incident: Unknown incident | Names: Karen C., Linda",Unknown,Calm,0.51
C355,"I'll say what's going on, he said I want to help Brown. He's on Brown, she's in ...",Unknown incident,"Incident: Unknown incident | Names: Brown, Brown | Urgency phrases: help, now",Unknown,Calm,0.68
C356,I just shot my mother in my... You shot your mother?,Unknown incident,Incident: Physical assault / fight,Unknown,Distressed,0.63
C357,I just witnessed a shooting on third Avenue in Nickers. Third in Nickers and how...,Physical assault / fight,Incident: Physical assault / fight | Locations: third Avenue,third Avenue,Distressed,0.66
C358,Oh my God! I'm not so lucky! You're right now! We used to talk about lightning! ...,Unknown incident,Incident: Unknown incident | Urgency phrases: now,Unknown,Calm,0.7
C359,We have an aircraft declaring an emergency is going to land on the beach at Veni...,Unknown incident,Incident: Unknown incident | Locations: Venice | Urgency phrases: emergency,Venice,Distressed,0.83
C360,"No, I think someone's in. David, you hear the front door? I'm hearing no lights,...",Unknown incident,Incident: Unknown incident | Names: David,Unknown,Distressed,0.61
C361,we heard looked in the garage door was up and i thought the gentleman was backin...,Unknown incident,Incident: Unknown incident,Unknown,Distressed,0.56
C362,We've been beating. It's the family daughter. I'm bleeding.,Physical assault / fight,Incident: Medical emergency | Urgency phrases: bleeding,Unknown,Distressed,0.6
C363,I have a gun range officer that got shot in the head. We're at a... Samture's po...,Physical assault / fight,Incident: Physical assault / fight | Names: Samture,Unknown,Distressed,0.67
C364,"I need 10 minutes right now for you. Okay, let's be a drag.",Unknown incident,Incident: Unknown incident | Urgency phrases: now,Unknown,Distressed,0.47
C365,We go up to this lady she laying in the road. I think she would get by a car. Ok...,Road accident / vehicle crash,Incident: Road accident / vehicle crash,Unknown,Distressed,0.6
C366,I'm going to ruin the way I'm at. But my line looks like this guy robbed and he ...,Robbery / theft in progress,Incident: Physical assault / fight,Unknown,Calm,0.5
C367,She cut me who cut you there's no no hold on,Unknown incident,Incident: Unknown incident,Unknown,Distressed,0.44
C368,Please have me try to get my house. What are they doing? They tied my fund door ...,Unknown incident,"Incident: Unknown incident | Urgency phrases: now, please",Unknown,Distressed,0.76
C369,"There's been a shooting, I just shot a man attack. We'll make a stop. OK, sir. I...",Physical assault / fight,Incident: Physical assault / fight,Unknown,Calm,0.77
C370,"I love me, I just love you more. Are you at a house? For a house?",Unknown incident,Incident: Unknown incident,Unknown,Calm,0.58
C371,"Yes, man, I just shot my doider and shot all my grandkids.",Missing person report,Incident: Physical assault / fight,Unknown,Distressed,0.64
C372,Because I'm not my way to work on North Sound on Redwood Road.,Road accident / vehicle crash,"Incident: Unknown incident | Locations: North Sound, Redwood Road",North Sound,Distressed,0.62
C373,"¡Ahhh! ¡Esto es eso! ¡Ay, un buen! ¡Cuál es la emergencia!",Unknown incident,"Incident: Unknown incident | Names: ¡Ahhh, ¡Ay, ¡Cuál",Unknown,Calm,0.79
C374,I got arrived from 21 to what's he's so cold? My 35 travels.,Unknown incident,Incident: Unknown incident,Unknown,Distressed,0.56
C375,"And there was a guy and there was a pistol and I was falling fake, but he's like...",Unknown incident,Incident: Unknown incident,Unknown,Distressed,0.61
C376,"I'll shut my husband and shut me, so we'll shut to me. Okay, hold on for me. Oka...",Unknown incident,Incident: Unknown incident,Unknown,Calm,0.55
C377,"I'm sorry, there's a situation here. We have residents that I think they stole a...",Road accident / vehicle crash,Incident: Road accident / vehicle crash,Unknown,Distressed,0.72
C378,I'm in a glory in a race where it's where I go away.,Unknown incident,Incident: Unknown incident,Unknown,Calm,0.66
C379,I think it's murder. What makes you think that? Because...,Unknown incident,Incident: Unknown incident,Unknown,Distressed,0.63
C380,"Um, I don't know if my husband had eyes rolling back. He's just not breathing.",Unknown incident,Incident: Unknown incident | Urgency phrases: now,Unknown,Distressed,0.56
C381,I'm out here right now and I lost my keys in my car. Is there any way that someo...,Road accident / vehicle crash,Incident: Road accident / vehicle crash | Urgency phrases: now,Unknown,Distressed,0.81
C382,It's not an emergency. The only way I know how to get in touch with this woman i...,Unknown incident,"Incident: Unknown incident | Urgency phrases: emergency, now",Unknown,Distressed,0.17
C383,What's going on there? Let's see what's going on there.,Unknown incident,Incident: Unknown incident,Unknown,Calm,0.61
C384,"Now, one, one, where's your emergency?",Unknown incident,"Incident: Unknown incident | Urgency phrases: emergency, now",Unknown,Distressed,0.48
C385,"Same. I hear you, br-",Unknown incident,Incident: Unknown incident,Unknown,Calm,0.54
C386,"I'm sorry, but the fireworks bill on. I'm sorry, you cannot call 911 for that.",Building fire / trapped persons,Incident: Building fire / trapped persons,Unknown,Distressed,0.29
C387,I just received a call a few minutes ago from one of our VPs who states that he'...,Unknown incident,Incident: Unknown incident,Unknown,Distressed,0.56
C388,If the Digman hit the park at 31st Avenue in Valmont.,Road accident / vehicle crash,"Incident: Road accident / vehicle crash | Locations: 31st Avenue, Valmont | Names: Digman",31st Avenue,Distressed,0.57
C389,It's a yes. Yes. The boys are here. Just a doubt. Let me have you. Ma'am. Ma'am.,Unknown incident,Incident: Unknown incident,Unknown,Calm,0.51
C390,There has been four gunshots. Close to the second. And it is in the middle.,Physical assault / fight,Incident: Physical assault / fight,Unknown,Distressed,0.63
C391,I cut my wife so sweet in the bathtub and I think she's dead. I want you with th...,Unknown incident,Incident: Unknown incident,Unknown,Distressed,0.73
C392,"We just found the body of a baby, my grandson.",Unknown incident,Incident: Unknown incident,Unknown,Distressed,0.66
C393,I would have brought behind him and his brother along with me and I called down ...,Unknown incident,Incident: Unknown incident,Unknown,Distressed,0.69
C394,This is our scouting utility emergency dispatch. We found a human skull. Oh my g...,Unknown incident,Incident: Unknown incident | Urgency phrases: emergency,Unknown,Distressed,0.8
C395,I need a police to come to my,Unknown incident,Incident: Unknown incident,Unknown,Distressed,0.79
C396,"Yes, no, I want to report a drug overdose.",Unknown incident,Incident: Unknown incident,Unknown,Distressed,0.65
C397,"Hello? Hello, my dad and my uncle just got shot. Okay. Oh my god, I don't like t...",Unknown incident,Incident: Physical assault / fight,Unknown,Distressed,0.78
C398,on the side of the guide. And you can tell my little foot in there now. OK. Can ...,Unknown incident,Incident: Unknown incident | Urgency phrases: now,Unknown,Calm,0.62
C399,"My brother, he was playing like with his gun.",Physical assault / fight,Incident: Unknown incident,Unknown,Distressed,0.53
C400,My brother is counting. Where are you at? I'm at the...,Unknown incident,Incident: Unknown incident,Unknown,Distressed,0.61
C401,"My guy, my girlfriend is yesterday. Calm down, sir. Is she still breathing?",Unknown incident,Incident: Unknown incident,Unknown,Distressed,0.48
C402,"We have a gunshot wound accidental in the household. Okay, how old?",Road accident / vehicle crash,Incident: Road accident / vehicle crash,Unknown,Distressed,0.68
C403,"Somebody just, somebody just take him in my house. What did he hit her in the he...",Road accident / vehicle crash,Incident: Road accident / vehicle crash,Unknown,Distressed,0.78
C404,There's a cleaning out of Rockville Road at 9.6.9.,Road accident / vehicle crash,Incident: Unknown incident | Locations: Rockville Road,Rockville Road,Distressed,0.57
C405,"I don't know what this kid has done, and she's like going into a theater or some...",Missing person report,Incident: Unknown incident | Urgency phrases: now,Unknown,Distressed,0.67
C406,"I got my gun out. There's somebody trying to get in my house. Okay, alright, let...",Physical assault / fight,Incident: Unknown incident,Unknown,Distressed,0.65
C407,"emergency. 5-001, there's man, we'll be done. 5-001.",Unknown incident,Incident: Unknown incident | Urgency phrases: emergency,Unknown,Distressed,0.78
C408,I can't hear you scream and I can't...,Unknown incident,Incident: Unknown incident,Unknown,Distressed,0.61
C409,"We're having a baby or in Boulder Creek. We need to get the shutter. Okay, what'...",Robbery / theft in progress,Incident: Unknown incident | Locations: Boulder Creek,Boulder Creek,Distressed,0.66
C410,Where's your emergency? I'll get a fire. Super-agore is following twig. Hold on ...,Building fire / trapped persons,Incident: Building fire / trapped persons | Urgency phrases: emergency,Unknown,Distressed,0.74
C411,"I just came home, the door was busted in and my girlfriend's been shot.",Unknown incident,Incident: Physical assault / fight,Unknown,Distressed,0.75
C412,"It just crashed into the Hudson River, a US Air.",Road accident / vehicle crash,Incident: Road accident / vehicle crash | Locations: the Hudson River,the Hudson River,Distressed,0.65
C413,I have the car. He just didn't get him. It was screaming at each other. This is ...,Road accident / vehicle crash,Incident: Road accident / vehicle crash,Unknown,Distressed,0.65
C414,"I've got a burglar. A burglar. Yes, ma'am. In the burglar.",Robbery / theft in progress,Incident: Robbery / theft in progress,Unknown,Distressed,0.6
C415,The baby's not playing me on this. It's a damn baby highlands avenue. 12 baby hi...,Unknown incident,Incident: Unknown incident,Unknown,Distressed,0.56
C416,Can I help you? Certainly. A couple of people who have picked over in the Great ...,Unknown incident,Incident: Unknown incident | Locations: the Great Salt Lake | Urgency phrases: help,the Great Salt Lake,Calm,0.58
C417,"No, I'm lonely. I'm lonely. Just broken into a house where I'm lonely. Please he...",Unknown incident,"Incident: Unknown incident | Urgency phrases: help, now, please",A House,Distressed,0.77
C418,My mouth is in the bathroom and in the tea cups.,Unknown incident,Incident: Unknown incident,Unknown,Distressed,0.57
C419,"I'm coming here to buy something. I've listened to this. When I get there, I'm i...",Unknown incident,Incident: Unknown incident,Unknown,Calm,0.55
C420,"Yeah, I was trying to find out if I knew to bring like any chick stoops or a",Missing person report,Incident: Unknown incident,Unknown,Distressed,0.59
C421,"I see some activity going on in the car and I don't think it's proper. Okay, wha...",Road accident / vehicle crash,Incident: Road accident / vehicle crash,Unknown,Distressed,0.58
C422,This is emergency 911 emergency. 340 soil.,Unknown incident,Incident: Unknown incident | Urgency phrases: emergency,Unknown,Distressed,0.99
C423,You said we dropped your store apart. Someone what? We just dropped your store a...,Unknown incident,Incident: Unknown incident,Your Store,Distressed,0.56
C424,floor. You'll be on the floor. She'll be on the floor. Okay. I'm going to tell y...,Unknown incident,Incident: Unknown incident | Urgency phrases: help,Unknown,Calm,0.55
C425,What's the problem? What's the problem there?,Robbery / theft in progress,Incident: Unknown incident,Unknown,Distressed,0.62
C426,It does crash. What? A plane crashed on 17th and Lincoln in houses.,Road accident / vehicle crash,Incident: Road accident / vehicle crash,Unknown,Distressed,0.61
C427,like gunshots being fired. Okay. I don't know where they're coming from. It was ...,Building fire / trapped persons,Incident: Building fire / trapped persons | Urgency phrases: now,Unknown,Distressed,0.58
C428,"My girlfriend, she has a sex boyfriend and she's been talking to hell out of her...",Unknown incident,Incident: Unknown incident,Unknown,Distressed,0.44
C429,We just got a cry that somebody had shot somebody in a health diagnosis.,Unknown incident,Incident: Physical assault / fight,Unknown,Distressed,0.79
C430,"We've missed all the kidnaps in the night. Thank you, thank you. Who is kidnappe...",Missing person report,Incident: Unknown incident,Unknown,Calm,0.6
C431,"of gentlemen in the center room, and the instrument, you change the room. A bank...",Robbery / theft in progress,Incident: Unknown incident,A Bank,Distressed,0.58
C432,"If I have been to the same thing, I will be open to the 14th, 2000, definitely a...",Unknown incident,Incident: Unknown incident,Unknown,Distressed,0.53
C433,"The man lying on the highway. He's lying down at the edge of the earth, but on h...",Unknown incident,Incident: Unknown incident,Unknown,Distressed,0.53
C434,"I want to talk, I want to talk, into my mouth, into my heart, my heart, my heart...",Medical emergency,Incident: Unknown incident,Unknown,Calm,0.67
C435,I am. My uncle's job is to put a knee snack in his girlfriend's back and I am pi...,Unknown incident,Incident: Unknown incident,Unknown,Distressed,0.59
C436,I ordered a Pinchy Chicken Leget with a small bite as...,Unknown incident,Incident: Unknown incident,Unknown,Distressed,0.52
C437,"Somebody just, somebody just, and I'm gonna send a call to the police. I'm gonna...",Unknown incident,Incident: Unknown incident,Unknown,Distressed,0.62
C438,"Help me. Okay, what's up, honey? My son isn't at least. I'm doing crazy.",Unknown incident,Incident: Unknown incident | Urgency phrases: help,Unknown,Distressed,0.71
C439,He'll let me cop a bean on quickClintus to move through the whole room Even shin...,Unknown incident,Incident: Unknown incident,Unknown,Distressed,0.6
C440,Brian Chessens at 7-1-Bot-Glorm Circle and he is wrestling us to get in my house...,Unknown incident,Incident: Unknown incident | Names: Brian Chessens,Unknown,Distressed,0.84
C441,"Yeah, I think it's least like that on my head. Yeah, man. We just got we just ca...",Robbery / theft in progress,Incident: Unknown incident,Unknown,Distressed,0.57
C442,Somebody walk into our house last night. I don't know.,Unknown incident,Incident: Unknown incident | Urgency phrases: now,Our House,Distressed,0.57
C443,My ass bloopers is staring at the hell out of me It's stopping in my head and my...,Unknown incident,Incident: Unknown incident,Unknown,Distressed,0.69
C444,"My partner's on fire, he can't. Err! Okay, stay on the line with me, don't hang ...",Building fire / trapped persons,Incident: Building fire / trapped persons | Names: Err | Urgency phrases: please,Unknown,Distressed,0.58
C445,I don't want Marge and Martin to stay. Help! It's a guy's coming! I can take him...,Unknown incident,Incident: Unknown incident | Names: Marge | Urgency phrases: help,Unknown,Calm,0.84
C446,"I think he had a parachute on him, a guy parachute.",Unknown incident,Incident: Unknown incident,Unknown,Distressed,0.55
C447,What's the problem there? There's a fire on pregnant. There's a fire at home? Ye...,Building fire / trapped persons,Incident: Building fire / trapped persons | Urgency phrases: please,Unknown,Distressed,0.73
C448,Why would the pan cut me? I need assistance right away. What happened? My wife h...,Unknown incident,Incident: Unknown incident | Urgency phrases: now,Unknown,Distressed,0.91
C449,I have a concern for a co-worker. She just called me and sounded very...,Unknown incident,Incident: Unknown incident,Unknown,Distressed,0.67
C450,"A white female passenger pass out on one of our vehicles, which is 21-22.",Road accident / vehicle crash,Incident: Road accident / vehicle crash,Unknown,Distressed,0.58
C451,"Hello, um, he's going down to the black way with my baby. Okay, where are you?",Unknown incident,Incident: Unknown incident,Unknown,Calm,0.67
C452,I'm going to turn this to the 258 from here. I'm going to turn the 258 from here...,Unknown incident,Incident: Unknown incident,Unknown,Distressed,0.52
C453,"I don't know. There's a lady laying out here on the side wall. Okay, bleeding. O...",Medical emergency,"Incident: Medical emergency | Urgency phrases: now, bleeding",Unknown,Distressed,0.61
C454,"Hi, my name is Jean Thomas. I'm watching my home on live monitor and there's a b...",Robbery / theft in progress,Incident: Unknown incident | Names: Jean Thomas,My House,Distressed,0.64
C455,"I'm going to start giving him out the lobby for any black. Miss, yes, General, I...",Unknown incident,Incident: Unknown incident | Urgency phrases: now,Unknown,Distressed,0.6
C456,There is a strange man outside our home and he hollered.,Suspicious activity,Incident: Suspicious activity,Unknown,Distressed,0.68
C458,My wife says in the bathroom she is bleeding all over the place. She thinks she'...,Medical emergency,Incident: Medical emergency | Urgency phrases: bleeding,Unknown,Distressed,0.67
C459,"and since May 8th, we've just got robbed. Okay, what they look like.",Robbery / theft in progress,Incident: Unknown incident,Unknown,Calm,0.66
C460,We've got a person here who is not fit to drive and needs to be taken to that sy...,Unknown incident,Incident: Unknown incident,Unknown,Distressed,0.8
C461,"because I'm the lady, I'm my teenage lady, she was yelling for help, and they lo...",Public disturbance / riot,Incident: Unknown incident | Urgency phrases: help,Unknown,Distressed,0.78
C462,"There's somebody killed someone. Okay, ask for where the suspect is.",Unknown incident,Incident: Unknown incident,Unknown,Distressed,0.66
C463,911.... We're at...,Unknown incident,Incident: Unknown incident,Unknown,Distressed,0.66
C464,"And easy and good shots of blood fire There, go against the middle of the high e...",Building fire / trapped persons,Incident: Building fire / trapped persons,Unknown,Calm,0.61
C465,I need an ambulance for two hours. Somebody just come and collect you up. What a...,Medical emergency,Incident: Medical emergency,Unknown,Distressed,0.72
C466,units know that it is confirmed rotation on the ground. Just want to roll our ho...,Unknown incident,Incident: Unknown incident | Urgency phrases: now,Our House,Distressed,0.57
C467,way into the north I've seen a funnel cloud just reporting my firstailing.,Public disturbance / riot,Incident: Unknown incident,Unknown,Distressed,0.62
C468,We just got in the tornado and the car slipped and the windows mercy and we're b...,Road accident / vehicle crash,Incident: Road accident / vehicle crash | Urgency phrases: bleeding,Unknown,Distressed,0.68
C469,I told you this came across there say 24 okay. Yeah,Unknown incident,Incident: Unknown incident,Unknown,Calm,0.47
C470,"Yeah, I have a rotating cloud coming in a southwest of Regis, as far as me.",Public disturbance / riot,Incident: Unknown incident,Unknown,Calm,0.59
C471,"Yes, it looks like we're gonna touch down on broad moral. Are you hard car? No, ...",Road accident / vehicle crash,Incident: Road accident / vehicle crash,Unknown,Calm,0.49
C472,"No, ma'am, we can see a tornado. We're at 914, Hillcrest. We have about five of ...",Unknown incident,Incident: Unknown incident | Locations: Hillcrest,Hillcrest,Calm,0.51
C473,"My mom, she's sick and she can't wait to see you. She can't wait, God.",Medical emergency,Incident: Unknown incident,Unknown,Calm,0.68
C474,I'm so glad we need the wheels to the car. She ran over three people in a row. W...,Road accident / vehicle crash,Incident: Road accident / vehicle crash,Unknown,Calm,0.77
C475,Where is the guy with the gun in the case he's with Ames? Which case is the Linc...,Physical assault / fight,Incident: Unknown incident | Names: Ames,Unknown,Distressed,0.64
C476,I'm just kidding the sounds of it. You can hear it in. Who is that? That's the c...,Missing person report,Incident: Unknown incident,Unknown,Distressed,0.46
C478,"My phone is on my phone. Okay, 615. It's okay.",Unknown incident,Incident: Unknown incident,Unknown,Calm,0.35
C479,"and then warrant. There's a fire back here at someone's front porch. Okay, where...",Building fire / trapped persons,Incident: Building fire / trapped persons,Unknown,Distressed,0.68
C480,We just saw a big airliner just being coated by two five planes.,Unknown incident,Incident: Unknown incident,Unknown,Distressed,0.6
C481,"So where will we have a revet? Okay, thank you.",Unknown incident,Incident: Unknown incident,Unknown,Calm,0.53
C482,emergency. Oh that's the F18 chasing a big commercial plane around and around al...,Unknown incident,Incident: Unknown incident | Urgency phrases: emergency,Those Downtown,Distressed,0.84
C483,"Yeah, I had two unusual aircraft fly really close.",Unknown incident,Incident: Unknown incident,Unknown,Calm,0.58
