Report_ID,Department,Doc_Type,Date,Program,Key_Detail
RPT_036,"LITTLE ROCK POLICE DEPARTMENT 700 WEST MARKHAM LI ie Manion Buckie TTLE ROCK, ARKANSAS 72201-1329 (501)-371-4605 Chief of Police Fax (501)-371-4892 February 19, 2015 Program Manager, 1033 Program Law Enforcement Support Office (LESO) DLA Disposition Services 74 Washington Avenue North Battle Creek, MI 49037 1. The Little Rock Police Department currently employees over 500 sworn officers. 2. The Aviation Unit currently supports our narcotic division, SWAT Team, and our Patrol Operations, The Aviation Unit is available to support and coordinate patrols and protect life and property, traffic control and surveillance, crime prevention, criminal surveillance, search and rescue, special surveillance details, apprehension of offenders and cover for ground elements. 3. The LRPD also maintains mutual aid response agreements with the other surrounding law enforcement agencies and cities to include: the City of North Little Rock, 44.8 square miles, census population of 62,304, the City of Cammack Village, .3 square miles, census population of 768, the City of Maumelle, 8.8 square miles, census population of 17,163, City of Sherwood, 20,6 square miles, census population of 29,523, City of Jacksonville, 28.1 square miles, census population of 28,364, City of Alexander, 2.2 square miles, census population of 2,901, the unincorporated areas of Pulaski County, 549.82 square miles, census population of 48,201. The Little Rock Police Department also maintains cooperative/mutual aid response assistance with the Arkansas State Police, the Arkansas State Capitol Police, the University of Arkansas Medical Science Hospital Police (UAMS), the University of Little Rock Police (UALR), Central Arkansas Veterans Hospital Police and the Pulaski Technical College Public Safety Department (PTC). The LRPD is also posed to respond to assist the law enforcement agencies located in the contiguous counties of Faulkner, Lonoke, Saline, Perry, Grant, and Jefferson. 4. High Intensity Drug Trafficking Area/HIDTA? The Little Rock Police Department is a member of the Gulf Coast HIDTA. 5. The Little Rock Police Department partners with Federal Agencies via task forces participation with FBI, DEA, U.S. Marshalls, and ATF. The City of Little Rock, which is LRPD is Internationally Accredited by the Commission on Accreditation for Law Enforcement Agencies The Little Rock Police Department is an equal opportunity employer",1033 Training Proposal,2015-02-19,Aviation Unit,"LITTLE ROCK POLICE DEPARTMENT 700 WEST MARKHAM LI ie Manion Buckie TTLE ROCK, ARKANSAS 72201-1329 (501)-371-4605 Chief o..."
RPT_037,"9. the state capitol of Arkansas, encompasses 116 square miles and has a census population of 193,525 in Pulaski County. . Geographic Responsibility? The Little Rock Police Department partners with Federal Agencies via task forces participation with FBI, DEA, U.S. Marshalls, and ATF. The City of Little Rock, which is the state capitol of Arkansas, encompasses 116 square miles and has a census population of 193,525 in Pulaski County. The Little Rock Police Department currently has a hanger facility that is secured by two gates and its buildings are alarmed. The hangers are capable of housing five aircraft. The Little Rock Police Department currently has a Department Operation Procedure for the use of the Helicopters. (See attached documents) The Little Rock Police Department currently has two OH-58 helicopters. 10. We are requesting two TH-67 aircraft. 11; Fiscal wherewithal? The Little Rock Police Department will assume the responsibility of maintaining the physical maintenance and upkeep of the helicopters to ensure their operational readiness. 12. The Little Rock Police Department has three (3) certified pilots that are currently license 13. to fly the current aircraft and the requested aircraft. (See attached Pilots license.) The anticipated number of hours flown per year is 100. 14, Special considerations? The City of Little Rock is the state capitol for the State of Arkansas and has the majority of the approximately 70,000 of the state employees and central offices for their agencies and approximately 20,000 of the Federal employees to include the Eastern and Western Districts of the United States Federal Courts, the Bill and Hillary Clinton National Airport, the William Jefferson Clinton Presidential Library and the largest number of level 1 trauma centers and hospitals, which are the UAMS, Baptist Medical Center, St. Vincent s Infirmary, McClellan VA Hospital and Arkansas Children s Hospital. . I certify that our appropriate Local Governmental administration has approved of this allocation for the two TH-67 aircraft. Kenton Buckner Chief of Police Little Rock Police Department LRPD is Internationally Accredited by the Commission on Accreditation for Law Enforcement Agencies The Little Rock Police Department is an equal opportunity employer",Police Document,Unknown,Aviation Unit,to fly the current aircraft and the requested aircraft
RPT_038,County Sheriff s Office,1033 Training Proposal,2015-12-01,MRAP Operations,"ent to intended use and training of the Mine ResistaCnotu Anmtyb Suhsehr Pifrf ost Oecftfiicon Vehicle, which was alloca..."
RPT_039,"County of Mississippi State of Arkansas SHERIFF S DEPARTMENT 685 North CR599 Luxora, Arkansas 72358 870-762-2243 FAX 870-658-2510 Mission #1 is to Protect and Serve AUBRY D. COOK SHERIFF December 17, 2014 The Mississippi County Sheriff's Department has received a Mine Resistant Ambush Protected Vehicle (MRAP) via the LESO 1033 program. The MRAP will be utilized by the Special Response team of the Mississippi County Sheriff's Department for the protection of its officers during high risk operations where such officers may be subjected to gunfire while in the performance of their duties. The vehicle will also be utilized for other purposes such as significant weather events and natural disasters where the off road capabilities of the vehicle can be utilized to assist the citizens of Mississippi County during such disasters. The vehicle may also be used in public relations events to allow the public to observe the capabilities of the vehicle. The Mississippi County Sheriff's Department has also implemented guidelines and training for the operation and maintenance of the vehicle. No officer will be allowed be allowed to operate the vehicle until he or she has completed a training course derived from military technical manuals and training materials and manufacturers manuals and training materials on the operation and maintenance of the vehicle. Training topics are included but not limited to the following: e An overview of the vehicle s capabilities and limitations. e Characteristics of the vehicle so that operators have knowledge of its size and weight. e Basic Maintenance Safe operation speeds and steering maneuvers e Use of Ground guides due to limited visibility e Operation on slopes e Rough terrain driving e Vehicle tip and rollover hazards e Falls, smashed and pinched extremities. e Rollover and Egress procedures. e Use of Seatbelts * Overhead obstacles such as risks of contact with overhead power lines.",1033 Training Proposal,2014-12-17,MRAP Operations,The Mississippi County Sheriff's Department has also implemented guidelines and training for the operation and maintenan...
RPT_040,"Pulaski County Office of the Sheriff Doc Holladay, Sheriff 2900 S. Woodrow St., Little Rock, AR 72204 Tel: (501) 340-6600 Fax: (501) 340-7080 June 8, 2015 Mr. James Ray, Law Enforcement Support Office RE: MRAP James: As of 6/1/15, the Pulaski County Sheriff's Office (PCSO) has implemented a policy for the operation and training of the Mine-Resistant Ambush Protected (MRAP) vehicle obtained from the Law Enforcement Support Office (LESO). The purpose of the vehicle is for use by the PCSO Special Weapons and Tactics (SWAT) Team in the protection of personnel during high risk operations by providing safe cover from potential gunfire while in the performance of their duties. Additional uses of this vehicle are to assist the citizens of Pulaski County during natural disaster events to navigate through extreme terrain or traverse over damaged areas when aiding citizens affected by such disasters. The policy contains guidelines for the operation and maintenance of the vehicle, based upon curriculum used in training established by the Center for Army Lessons Learned and published by the Combined Arms Center at Fort Leavenworth, Kansas, titled MRAP Vehicle Tactics, Techniques ai and Procedures. The training will consist of the following: 1. Overview of the vehicle to include capabilities and limitations. 2. Vehicle characteristics. 3. Maintenance. 4. Safe operating speeds. 5. Vehicle steering, movement and proper maneuvering. 6. Ground guiding techniques due to limited visibility. 7. Operations of slopes. 8. Restricted terrain. 9. Rough terrain driving. 10. Vehicle tip over and roll-over, to include egress procedures. This training will include both classroom and practical hands-on exercises. Sincerely, Doc Holladay > Pulaski County Sheriff DH:so ce: File",1033 Training Proposal,2015-06-08,MRAP Operations,"James Ray, Law Enforcement Support Office RE: MRAP James: As of 6/1/15, the Pulaski County Sheriff's Office (PCSO) has i..."
RPT_041,"MIKE MCGOUGH \ 250 AMERICAN ROAD SHERIFF EL DORADO, ARKANSAS 71730 BILL HICKMAN PHONE 870-864-1970 CHIEF DEPUTY Fax 870-864-1992 June 1, 2015 Re: Mine Resistant Ambush Protected (MRAP) Vehicle To Whom It May Concern: The Union County Sheriff's Office has implemented a policy for the operation and training of the MRAP vehicle obtained through the LESO/1033 program. The purpose of this vehicle is to be used by the Union County Sheriff's Office Special Response Team for the protection of officers during high risk operations for the safety of such officers from potential gunfire while in the performance of their duties. Additional use of the MRAP will be to assist the citizens of Union County during natural disaster events to navigate through extreme terrain or to drive over damaged areas to assist the citizens who are affected from the disasters. The policy has guidelines for the operation and maintenance of the vehicle. It states no officer will be allowed to operate the MRAP without any training. The training will be conducted by a trained military member who has extensive training in use and operation by the United States Army and also has used the MRAP during deployments. All training curriculum used in training is derived from the Center for Army Lessons Learned published by the Combined Arms Center. The training will consist of the following: -Overview of the vehicle to include its capabilities and limitations -Characteristics of the vehicle so the operator will know the size and weight -Basic maintenance -Safe operating speeds -Movement and maneuver -Ground guiding techniques for safe operation in small areas due to limited visibility -Operation on slopes -Restricted terrain -Rough terrain driving",1033 Training Proposal,2015-06-01,MRAP Operations,"MIKE MCGOUGH \ 250 AMERICAN ROAD SHERIFF EL DORADO, ARKANSAS 71730 BILL HICKMAN PHONE 870-864-1970 CHIEF DEPUTY Fax 870-..."
RPT_042,"-Vehicle tip and rollover -Steering and proper maneuvering -Falls, smashed and pinched extremities -Rollover/Egress procedures -Use of seatbelts -Risk and contact with high voltage power lines These items will include a classroom portion hands on drivers portion. } ~ Uke ter Sheriff Mike McGou Union County Sheriff's Office",Police Document,Unknown,General Law Enforcement,"-Vehicle tip and rollover -Steering and proper maneuvering -Falls, smashed and pinched extremities -Rollover/Egress proc..."
