Report_ID,Department,Doc_Type,Date,Program,Key_Detail
RPT_017,"COURSE: LESSON TITLE: CLEET Continuing Education Course Mine Resistant Ambush Protection Vehicle Operations DURATION: TRAINING LEVEL: PREPARED BY: Cpl Monty McMillen 5.0 Hours Swat Team Operators CLEET Instructor Number of Trainees: 16 Date: June 30th, 2014 METHOD OF PRESENTATION: INSTRUCTOR: CLEET Instructor Lecture, Questions & Answers, Visual Presentation APPROVED BY: CLEET Standards Division LEARNING GOAL: The student will become familiar with the basic Operations of the Mine Resistant Ambush Protection Vehicle (MRAP). PERFORMANCE OBJECTIVES: 1. The student will be able to identify the Power Plant and transmission, as presented by the Instructor. 2. The student shall be able to identify the control panel and identify all gauges and lights, as well as, switches, as presented by the Instructor. 3. The student shall be able to identify the routine maintenance required, as presented by the Instructor. 4. The student shall be familiar with the passenger capacity, as well as, load weights, as presented by the Instructor. 5. The student shall be familiar with the Vehicle Operations, as presented by the Instructor. 6. The student shall be familiar with vehicle recovery operations, as presented by the Instructor. 7. The student shall demonstrate proper driving techniques for both highway and off road operations. 8. The student shall demonstrate proper evacuation techniques in case of an accident or other emergency situation. ( completed EGRIS training at FCMTC MRAP roll over simulator) TRAINING AIDS REQUIRED: 1. A/V projector 2. MRAP Training was completed at the FCMTC. Students also received instruction from a retired US Army Master Driver, as well as some additional vehicle maintenance training with current FCMTC Maintenance personnel. Fort Smith Police Department Mine Resistant Ambush Protection Vehicle Primary Purpose: Special Response and Tactics / Operations Search and Rescue",Lesson Plan,Unknown,MRAP Operations,COURSE: LESSON TITLE: CLEET Continuing Education Course Mine Resistant Ambush Protection Vehicle Operations DURATION: TR...
RPT_018,Hot Springs Police Department S.W.A.T. Training Cover Sheet Subject: MRAP Operations Duration of Class: 8 hours Level of Instruction: Basic Target Group: Hot Springs Police Department S.W.A.T. Team Course Prepared by: Ofc. Eric Wacaster Revisions: N/A Date of Instruction: 5/5/15 Location: Hot Springs Airport. 1,Police Document,Unknown,MRAP Operations,Training Cover Sheet Subject: MRAP Operations Duration of Class: 8 hours Level of Instruction: Basic Target Group: Hot S...
RPT_019,"Hot Springs Police Department S.W.A.T. Training Course Summary Sheet Course Title: MRAP Operations Purpose of the Course: To familiarize Hot Springs Police Department SWAT Operators with basic MRAP functions, preventative maintenance, and driving operations of the MRAP. Objectives: At the end of the block of instruction the students will be able to successfully: 1. Identify the Power Plant and transmission, as presented by the Instructor. 2. Identify the control panel and identify all gauges and lights, as well as, switches, as presented by the Instructor. 3. Identify the routine maintenance required, as presented by the Instructor. 4. Demonstrate familiarity with the passenger capacity, as well as load weights, as presented by the Instructor. 5. Demonstrate familiarity with the Vehicle Operations, as presented by the Instructor. 6. Demonstrate familiarity with vehicle recovery operations, as presented by the Instructor. Certification: Eric Wacaster is a police officer and SWAT Team member with the Hot Springs Police Department. He is a certified police and firearms instructor through the Commission on Law Enforcement Standards. He is also a certified Force on Force instructor through General Dynamics. Ofc. Zac Rostan will assist with instruction. Ofc. Rostan is a police officer and SWAT team member with Hot Springs Police Department as well as a staff sergeant in the United States Army Reserve. Ofc. Rostan is a veteran of multiple overseas deployments where he has operated MRAPs in theater. He has also trained multiple other soldiers in the use and operation of MRAPs. 2",Police Document,Unknown,MRAP Operations,Training Course Summary Sheet Course Title: MRAP Operations Purpose of the Course: To familiarize Hot Springs Police Dep...
RPT_020,"Hot Springs Police Department S.W.A.T. Training Course Outline I. Introduction A. General vehicle familiarization and identification 1. Power Plant 2. Transmission 3. Control Panel 4. Lights, switches, and gauges II. Body A. Routine and Preventative Maintenance B. Passenger Capacity and Load Limits C. Vehicle Operations 1. Start up and Shut Down Procedure 2. Driving and Vehicle Clearances 3. Parking 4. Vehicle Recovery III. Conclusion A. Operators will correctly demonstrate all objectives back to the instructor 3",Police Document,Unknown,General Law Enforcement,General vehicle familiarization and identification 1
RPT_021,"STEVE JEFFERY P.O. Box 4236 Tel: 870-793-8838 Sheriff Batesville, Arkansas 72503 Fax: 870-612-6849 eee OE OL EGON 05/21/2015 To: | Whom it May Concern Re: MRAP Vehicle To Whom it May Concern, This letter is to inform you that the Independence County Sheriff's Office has implemented policy for the operation and training of the MRAP vehicle obtained through the LESO/1033 program. The purpose of this vehicle is to be used by the Independence County Sheriff's Office for the protection of officers from potential gunfire during high risk operations and to assist the citizens of Independence County during natural disaster events to navigate through extreme terrain or drive over damaged areas to assist citizens. Only officers who are trained in the operation of the MRAP will be allowed to operate it. Those who are authorized to operate the MRAP vehicle at this time are former United States Military members who have past training and actual field experience driving an MRAP vehicle. Those Officers are: Deputy Johnny Byler Deputy Andrew Rogers During the month of June 2015, other officers will be receiving instruction and training on the operation of the MRAP vehicle, to include topics covered in training material produced by the Center for Army Lessons Learned. The Independence County Sheriff's Office recognizes that the this vehicle is property of the United States Government and assigned to this agency. If and when this agency no longer has a need for this vehicle it shall be transferred back to another LEA, or returned to the United States Government. dG Y J Aa Steve Jeffery Sheriff",1033 Training Proposal,2015-05-21,MRAP Operations,"Box 4236 Tel: 870-793-8838 Sheriff Batesville, Arkansas 72503 Fax: 870-612-6849 eee OE OL EGON 05/21/2015 To: | Whom it ..."
RPT_022,"Whom it may Concern From: Lt. Brett Hibbs Date: January 14, 2015 Ref: MRAP The following documentation is intended to document to intended use and training of the Mine Resistatant Ambush Protection Vehicle, which was allocated to the Jacksonville AR Police Department, by the United States Government. The Jacksonville Police Department recognizes this vehicle is the Property of the United Stated government and assigned to this agency, if and when this agency no longer has a need for this vehicle it shall be transferred to another LEA, or returned to the United Stated government. Respectfully, Lt. Brett Hibbs Jacksonville Police Department AR Special Response Team Commander",Police Document,2015-01-14,MRAP Operations,"Brett Hibbs Date: January 14, 2015 Ref: MRAP The following documentation is intended to document to intended use and tra..."
RPT_023,The Jefferson County Sheriff s Office,Standard Operating Procedure,2015-01-13,MRAP Operations,"Mine Resistant Ambush Protected (MRAP) Vehicle Standard Operating Procedure (SOP) Effective Date: January 13, 2015 Revis..."
RPT_024,"LITTLE ROCK POLICE DEPARTMENT DIVISIONAL OPERATING PROCEDURE AVIATION UNIT DISTRIBUTION: REPLACES: NUMBER: DIVISIONAL NEW 5600-12 DATE: 04/26/2012 I. Purpose A. B. Cc. Dz. The magnitude of demands for police service increases as today s society becomes more mobile and affluent. It becomes more evident that rapid mobility, providing swiftness of response, in all areas of police service is essential. The growing complexity of police work has resulted in an increase in specialization and some modification in the previously accepted concept of patrol duties. The successful implementation of the preventative patrol concept requires adaptation of new techniques to our patrol efforts. The objectives of the program are directly related to the insertion of helicopters into the patrol function. The following examples serve to emphasize the desired objective: 1. Supporting and coordinating patrols and the protection of life and property; 2. Traffic control and surveillance; 3. Crime prevention; 4. Criminal surveillance; 5. Search and rescue; 6. Special surveillance details; 7. Apprehension of offenders; and, 8. Cover for ground elements. The above examples of objectives to be accomplished have one factor in common. Cooperation between ground units and aircraft is essential. The capabilities of the patrol car and aircraft can do much to achieve these goals only when they are used in a coordinated effort to support each other. It is evident, therefore, that the success of this program requires the active support of every member of our Department. Accountability - The Aviation Unit is supervised by the Aviation Unit Sergeant, The Aviation Unit Sergeant is also the Special Events Coordinator who is directly responsible to the Aviation Unit Lieutenant, who is the Special Units Commander. The Aviation Unit Lieutenant is directly responsible to the Headquarters Division Commander. Headquarters Division 5600-12-1 Divisional Operating Procedure",Police Document,2012-04-26,Aviation Unit,LITTLE ROCK POLICE DEPARTMENT DIVISIONAL OPERATING PROCEDURE AVIATION UNIT DISTRIBUTION: REPLACES: NUMBER: DIVISIONAL NE...
RPT_025,"Il. Responsibility A. 10. ll. 12. Headquarters Division The Aviation Unit observers are supervised by the Aviation Unit Sergeant. The Aviation Unit Sergeant will be available as needed on a part-time basis unless special mission assignment details his/her additional presence. The Aviation Unit s hours of assignment will be varied according to the needs of the Department. In the event that an observer or alternate is not available for duty for any reason, the Aviation Unit Sergeant will amend his/her hours to man the shift. Aviation Unit Sergeant Responsibilities Be familiar with and obey all General Orders, Directives, and Rules and Regulations of the Little Rock Police Department, Coordinate and formulate plans for the operation of the Unit s aircraft and related activity; Keep the Aviation Unit Lieutenant informed of all operational phases of the Aviation Unit; Acquaint all personnel under his supervision with such orders, directives, and policies requiring compliance; Be aware of the training needs of the members of the Unit and ensure that the necessary training is provided; Closely evaluate personnel assigned to the Unit during their training, in accordance with existing procedures; Assume the responsibility for the supervision of all assigned duties to ensure the efficient and proper performance of such duties; Develop and implement a public relations program that will tend to achieve public acceptance and approval of the Departmental use of the aircraft; Ensure that required reports are properly submitted by himself and members of the Aviation Unit; Establish and maintain an effective relationship with the FAA; Assist in the formulation of plans for the operation of the Aviation Unit; Maintain schedules and supervise activity of the part-time observers, pilots and mechanic assigned to the Unit. 5600-12-2 Divisional Operating Procedure",Police Document,Unknown,Aviation Unit,"Aviation Unit Sergeant Responsibilities Be familiar with and obey all General Orders, Directives, and Rules and Regulati..."
RPT_026,"13. Oversee the LESO 10-33 program in which government property may be obtained for the police department. a) Supervise and ensure the quarterly inventories of items obtained from the 10-33 program are conducted and maintained pursuant to Departmental guidelines regarding records retention. 14. The Aviation Unit Sergeant will ensure that all flight and maintenance operations of the unit are maintained in accordance with the current Federal Aviation regulations and manufacturers requirements. He/she will ensure that all pilot and medical certificates required by the Department and the Federal Aviation Administration (FAA) are maintained in accordance to established regulations and guidelines. B. Observer Responsibilities 1, General a) The part-time observers are assigned to the Headquarters Division for operational purposes and report to the Aviation Unit Sergeant. b) Prepare and submit written reports, as required, by proper authority. 2. Function a) Ascertain operational assignments and coordinate _ this information with the pilot. b) Become knowledgeable with available information concerning any assigned flight. c) Assure that all necessary auxiliary equipment is operational and properly stowed on board the aircraft. d) Be alert for any condition that could affect the safe operation of the aircraft. e) Ensure that all police communications equipment is operational. 3. Observer In-Flight Responsibilities Headquarters Division a) Be alert for aircraft, obstructions, or unsafe conditions, which may affect the safe operation of the aircraft. b) Comply with the directions from the pilot on any matter pertaining to the safe operation of the aircraft. c) Operate auxiliary equipment as required. (1) Required equipment: An operable fire extinguisher, first aid kit and emergency locator transmitter (ELT) shall be kept in each aircraft at all times while the aircraft is being used. 5600-12-3 Divisional Operating Procedure",1033 Training Proposal,Unknown,Aviation Unit,"Observer Responsibilities 1, General a) The part-time observers are assigned to the Headquarters Division for operationa..."
RPT_027,An Officer s Report,Police Document,Unknown,General Law Enforcement,"The pilot will be responsive to the requests of the observer in order to accomplish the police mission; however, the pil..."
RPT_028,the Office of the Chief of Police,Police Document,Unknown,Aviation Unit,"The pilot is responsible for conducting the briefing, which should include the following: (1) Proper wearing of seat bel..."
RPT_029,Departmental,Police Document,Unknown,Aviation Unit,"c) For safety purposes, every reasonable attempt should be made to IIL"
RPT_030,"(1) The Headquarters Division Commander or in his absence, the Section Commander, may approve requests for aircraft service in cities contiguous to Little Rock. (2) Requests should be limited to police emergencies and extended car chases. A police emergency is defined as an on-going, life threatening situation, where the aircraft can be of definite, positive assistance. b) Non-Contiguous Cities - Requests for aircraft service in non- contiguous cities must be approved by the Division Commander or Bureau Commander unless an emergency situation exists. c) The Aviation Unit Lieutenant and the Aviation Unit Sergeant will be notified as soon as possible of any newsworthy or sensational incidents involving the aircraft s use outside the City Limits of Little Rock. d) At no time will a request for aircraft service outside the City of Little Rock be approved if the aircraft is needed within the City. IV. Local Flying Regulations A. General 1, Purpose - The purpose of this section is to provide information and guidance, prescribe general policies to all Police Department personnel utilizing the facilities at Airports, and further establish local flying regulations for all flights by Police Department personnel within the City of Little Rock. 2. Scope a) Policies and procedures contained in this section are directive in nature and supplement existing directives of the Department and Federal Air Regulations. b) Additions, deletions, and amendments will be published as required. Recommendations for revisions should be submitted to the Headquarters Division Commander. c) Violations or deviations from these regulations, including forced landings, must be reported to the Headquarters Division Commander. B. Flight Regulations 1. Aircraft Clearances - Flights conducted under a local flight clearance are subject to the following restrictions: a) Must adhere to Visual Flight Rules (VFR) at all times; Headquarters Division 5600-12-11 Divisional Operating Procedure",Standard Operating Procedure,Unknown,Aviation Unit,"(1) The Headquarters Division Commander or in his absence, the Section Commander, may approve requests for aircraft serv..."
RPT_031,Police Aviation Unit,Police Document,Unknown,Aviation Unit,Pilots and observers assigned to the Unit will assist him with any or all of his duties as may be required to fulfill th...
RPT_032,"K. Miscellaneous 1. No officer will fire any weapon from the aircraft. 2. Doors may be removed from the aircraft only with an Aviation Unit s supervisor s approval. If removal for an emergency reason should become necessary, the Quick Release Pin should remain with the door. Proper care should be taken in removing and placing the doors in a secured area to prevent any damage. Appropriate airspeed limitations will be complied with. Vv. Procedures for Radio Service Calls A. Aviation Unit personnel shall respond to all requests for service made by members of the Police Department. B. When on regular patrol, Aviation Unit personnel will respond to any call where the aircraft can be of use to the officers on the ground or assist in the arrest of a suspect. Cc. Effective communications is essential with the officers on the ground. VI. Reports A. Shift Summary Reports are due daily as needed upon mission activity or an emergency call-out basis detailing the flight(s), specific activity conducted, etc... Vil. Annual Review A. The Sergeant of the Aviation Unit will do an annual review of the Unit. B. The Annual Report is due in December with the other end of the year reports for the Headquarters Division. c. An assessment will be made to determine the effectiveness of the program and the need for additional Aviation Unit personnel. Headquarters Division 5600-12-17 Divisional Operating Procedure",Police Document,Unknown,Aviation Unit,Aviation Unit personnel shall respond to all requests for service made by members of the Police Department
RPT_033,"NY City of Little Rock Police Department 700 West Markham Little Rock, Arkansas 72201-1329 MEMORANDUM TO: Capt. Robertson FROM: Lt. T. Calhoun #14461 RE: MRAP Training DATE: June 17, 2014 The Department recently acquired two Mine Resistant Ambush Protected (MRAP) vehicles. The operator training, which will train officers as operators and enable them to train other operators, is scheduled for July 1"" and 2 at our Training Division. The training is a one-day 10-hr. course that costs $175.00 per participant. Lt. Jackson has requested one slot for the Special Response Unit and Fleet Services has requested one slot for a mechanic. I request authorization to send Ofc. A. Metcalf (#21333 a Department Defensive Driving Instructor) and S. Young (#31041 has MRAP experience from the military) from the SWAT Unit to this training course. . Lt. Jackson requested that Sgt. J. Plunkett (#18783) from the SRU attend the course and Mr. Walter Ederle (Fleet Services Operations Manager) will advise of a mechanic who will be designated to perform service work on the vehicles. Total cost of the training would be $700.00. Macef Fares, wu aA cal geheclle our Led \s \nvsh We deve teeing cle. fes au ' Sclectect sesso 48 etlend one ut dese cletes - Olnes agencies tre \ ' toe ches ~ recently yttetued a MeAP GL Yeceroe reinoy. ous these two od \ Petommend Cpprouc Capt Adah G. 18 zor paper Aa lo 'FOAY Chen 23 nm",Memorandum,2014-06-17,MRAP Operations,"Calhoun #14461 RE: MRAP Training DATE: June 17, 2014 The Department recently acquired two Mine Resistant Ambush Protecte..."
RPT_034,"LAW ENFORCEMENT AGENCY (LEA) AIRCRAFT REQUEST popaAac; 2YTGUC AGENCY NAME: LITTLE ROCK POLICE DEPARTMENT AIRCRAFT poc: LT. NATHAN TACKETT ADDRESS (No P.O. Box): 700 W. MARKHAM STREET cry; LITTLE ROCK STATE: AR zip; 72201 EMAIL; Mtackett@littlerock.org PHONE: (501) 918-5203 PAX: (501) 918-5125 1, Type of Aircraft Requested:___X_Rotary Fixed Wing a. If rotary, specific model: OH-58 [_Jou-s [Junin [Jun i [| UHIN [] Other; TH-67 b. If fixed wing, specific model: cx ] C172 ] cisa[_] Other: c. If something other than marked/stated above comes available, would you like to be offered it? __ Yes ~ SC No Thank You 2. Number of Aircraft Requested: 2 Flyable 0 Non-Flyable Geographic Responsibility (Square Miles Covered): 110 Is the LEA in a High Intensity Drug Trafficking Area (HIDTA): Yes Ovo Verify at: http://www. whitehousedrugpolicy.gowhidta Anticipated Annual Flight Hours: 1000-2000 Number/Type of 1208/1033 Aircraft Currently on Inventory: 2/ OH-58 a The Chief Executive Official/Head of Agency (Local Field Office), by signing, certifies that the requesting agency listed above has the appropriate funds, personnel (qualified pilots and maintainers), hanger/apron space, and equipment to operate and maintain the requested aircraft. It is also understood that this agency will not sell, trade, or cannibalize for parts, aircraft acquired through the 1033 Program. They certify that all information contained above is accurate and the request for aircraft is warranted and has been approved CHIEF EXECUTIVE OFFICIAL/: CHIEF KENTON BUCKNER DATE: 92/17/2015 HEAD OF LOCAL AGENCY PRINTED NAMIa Lo . le ey: SIGNATURE STATE COORDINATOR: me i mes Ra, { DATE:_2-179-)S (NOT REQUIRED FOR FEDERAL) PRINTED )jAME SI RE LESO USE ONLY LESO OFFICIAL: PRINTED NAME SIGNATURE DATE LEA WAS ADDED TO THE NATIONAL PRIORITY LIST: LESO NOTES: DISAPPROVED BY LESO:[_] REASON:",Aircraft Request,92/17/2015,Aviation Unit,gowhidta Anticipated Annual Flight Hours: 1000-2000 Number/Type of 1208/1033 Aircraft Currently on Inventory: 2/ OH-58 a...
RPT_035,"LAW ENFORCEMENT AGENCY (LEA) AIRCRAFT REQUEST povaac:2 TGUC ___acency nap, LITTLE ROCK POLICE DEPARTMENT AIRCRAFT poc: LT. NATHAN TACKETT ADDRESS (No P.O. Box): 700 W. MARKHAM STREET erry: LITTLEROCK gta, ARKANSAS ZIP: 72201 EMAIL; _ Mtackett@littlerock.org PHONE: 501-918-5203 [ROTARY [FIXED OTHER, THT Cd [quantity If something other than marked/stated above comes available, would you like to be offered it? Yes 7 We rthnnk ou ****NOTE: The Aircraft justification letter, Safety Standards/Training Plan, and copies of pilot s license must accompany this aircraft request Fax: 901-918-5125 The Chief Executive Official/Head of Agency (Local Field Office), by signing, certifies that the requesting agency listed above has the Appropriate funds, personnel (qualified pilots and maintainers), hanger/apron space, and equipment to operate and maintain the requested aircraft. [tis also understood that this agency will not sell, trade, or cannibalize for parts, aircraft acquired through the 1033 Program. They certify that all information contained above is accurate and the request for aircraftis warranted and has been approved CHIEF EXECUTIVE OFFICIAL/: CHIEF KENTON BUCKNER pare; 92-17-2015 HEAD OF LOCAL AGENCY en biel Ue J (7 b SIGNATURE | STATE COORDINATOR: SS DATE: 2-)7-)S_ (NOT REQUIRED FOR FEDERAL) PRINTED NAME ana eh kk LESO USE ONLY Ce ee LESO OFFICIAL: PRINTED NAME SIGNATURE DATE LEA WAS ADDED TO THE NATIONAL PRIORITY LISTING: LESONOTES: DISAPPROVED BY LESO:",Aircraft Request,92-17-2015,Aviation Unit,"org PHONE: 501-918-5203 [ROTARY [FIXED OTHER, THT Cd [quantity If something other than marked/stated above comes availab..."
